{
  "catalog_version": "1.0.0",
  "catalog_name": "Frangel Barrera — Public Repository Catalog",
  "owner": "frangelbarrera",
  "scope": {
    "included": "Public repositories owned by frangelbarrera, excluding the profile index repository itself.",
    "fork_policy": "Forks created for pull requests are excluded. The wstg fork is included as the sole explicitly allowed exception because it is the maintained Spanish translation project.",
    "private_repositories": "Excluded.",
    "claims_policy": "Descriptions are limited to repository metadata and README-supported facts. Maturity is not_assessed unless the repository explicitly identifies a research, curated, translation, prototype, or early-stage role."
  },
  "taxonomy": {
    "curated_lists_and_directories": "Editorial lists, directories, and guides.",
    "ai_agents_and_agent_infrastructure": "Agent runtimes, orchestration, control planes, and MCP infrastructure.",
    "osint_and_threat_intelligence": "Open-source intelligence, investigation, and cyber-threat-intelligence projects.",
    "network_and_infrastructure_security": "Network, cloud, Windows, and infrastructure security tools.",
    "ics_ot_and_scada_security": "Industrial control systems, OT, SCADA, and related security work.",
    "application_and_ai_security": "Application security, AI security, phishing defense, and code-security tooling.",
    "malware_and_binary_analysis": "Malware analysis, reverse engineering, and defensive research.",
    "research_and_evaluations": "Evaluations, benchmarks, and research-oriented artifacts.",
    "software_quality_and_developer_tools": "Developer productivity and software-quality tooling.",
    "open_source_translations_and_documentation": "Translations and documentation-maintenance projects.",
    "software_and_product_prototypes": "Application prototypes and reusable software foundations.",
    "cloud_and_infrastructure_security": "Cloud, Windows, and infrastructure security tools."
  },
  "entries": [
    {
      "name": "Abster-Intelligence",
      "url": "https://github.com/frangelbarrera/Abster-Intelligence",
      "visibility": "public",
      "primary_category": "osint_and_threat_intelligence",
      "secondary_categories": [
        "privacy_and_local_first"
      ],
      "project_type": "software",
      "summary": "Local-first OSINT platform for investigators, presented by the repository as open-source and privacy-centric.",
      "technologies": [
        "TypeScript"
      ],
      "maturity": "not_assessed",
      "license": "Apache-2.0",
      "source_basis": [
        "repository_description",
        "repository_readme",
        "github_metadata"
      ],
      "last_verified": "2026-09-07",
      "capabilities": [
        "OSINT workflows",
        "investigative workspace"
      ],
      "caveat": "Capabilities and production readiness were not independently benchmarked."
    },
    {
      "name": "aegistrace-threat-intelligence",
      "url": "https://github.com/frangelbarrera/aegistrace-threat-intelligence",
      "visibility": "public",
      "primary_category": "osint_and_threat_intelligence",
      "secondary_categories": [
        "defensive_security",
        "data_pipelines"
      ],
      "project_type": "software",
      "summary": "Python CTI pipeline that collects and enriches IoCs from five feeds, produces Plotly and CSV outputs, and forecasts seven-day threat trends.",
      "technologies": [
        "Python"
      ],
      "maturity": "not_assessed",
      "license": "MIT",
      "source_basis": [
        "repository_description",
        "repository_readme",
        "github_metadata"
      ],
      "last_verified": "2026-09-07",
      "capabilities": [
        "IoC collection",
        "feed enrichment",
        "dashboard",
        "CSV export",
        "trend forecasting"
      ],
      "caveat": "Forecasts and feed quality require independent validation."
    },
    {
      "name": "agentic-harness",
      "url": "https://github.com/frangelbarrera/agentic-harness",
      "visibility": "public",
      "primary_category": "ai_agents_and_agent_infrastructure",
      "secondary_categories": [
        "llm_workflows",
        "mcp"
      ],
      "project_type": "software",
      "summary": "Python agent harness for auditable, cost-controlled LLM workflows using YAML playbooks and MCP server support.",
      "technologies": [
        "Python"
      ],
      "maturity": "not_assessed",
      "license": "Apache-2.0",
      "source_basis": [
        "repository_description",
        "repository_readme",
        "github_metadata"
      ],
      "last_verified": "2026-09-07",
      "capabilities": [
        "YAML playbooks",
        "workflow execution",
        "cost controls",
        "MCP support"
      ],
      "caveat": "Not represented as production-ready without an independent operational review."
    },
    {
      "name": "Artificial-Intelligence-Universe",
      "url": "https://github.com/frangelbarrera/Artificial-Intelligence-Universe",
      "visibility": "public",
      "primary_category": "curated_lists_and_directories",
      "secondary_categories": [
        "ai_tools",
        "mcp",
        "learning_resources"
      ],
      "project_type": "curated_directory",
      "summary": "Curated directory of AI tools, agents, LLMs, MCP servers, and learning resources.",
      "technologies": [],
      "maturity": "curated",
      "license": "MIT",
      "source_basis": [
        "repository_description",
        "repository_readme",
        "github_metadata"
      ],
      "last_verified": "2026-09-07",
      "capabilities": [
        "Editorial categorization",
        "resource discovery"
      ],
      "caveat": "Entries are curated references; inclusion is not an endorsement."
    },
    {
      "name": "awesome-ai-agents",
      "url": "https://github.com/frangelbarrera/awesome-ai-agents",
      "visibility": "public",
      "primary_category": "curated_lists_and_directories",
      "secondary_categories": [
        "ai_agents",
        "mcp",
        "evaluations"
      ],
      "project_type": "curated_list",
      "summary": "Curated list of AI agent frameworks, coding and automation agents, MCP servers, and evaluation tools.",
      "technologies": [],
      "maturity": "curated",
      "license": "CC0-1.0",
      "source_basis": [
        "repository_description",
        "repository_readme",
        "github_metadata"
      ],
      "last_verified": "2026-09-07",
      "capabilities": [
        "Repository discovery",
        "editorial curation"
      ],
      "caveat": "Entries are curated references; project status belongs to each linked project."
    },
    {
      "name": "Awesome-Hacking-with-AI",
      "url": "https://github.com/frangelbarrera/Awesome-Hacking-with-AI",
      "visibility": "public",
      "primary_category": "curated_lists_and_directories",
      "secondary_categories": [
        "ai_security",
        "security_research"
      ],
      "project_type": "curated_guide",
      "summary": "Curated guide to AI-powered offensive security, red-team operations, prompt injection, and adversarial AI research.",
      "technologies": [
        "Python"
      ],
      "maturity": "curated",
      "license": "MIT",
      "source_basis": [
        "repository_description",
        "repository_readme",
        "github_metadata"
      ],
      "last_verified": "2026-09-07",
      "capabilities": [
        "Resource curation",
        "security research references"
      ],
      "caveat": "The guide is for lawful, authorized research; inclusion is not an endorsement."
    },
    {
      "name": "Cloud-Misconfig-Scanner",
      "url": "https://github.com/frangelbarrera/Cloud-Misconfig-Scanner",
      "visibility": "public",
      "primary_category": "cloud_and_infrastructure_security",
      "secondary_categories": [
        "cloud_security",
        "cli"
      ],
      "project_type": "security_tool",
      "summary": "Python CLI for detecting AWS S3 storage misconfigurations; Azure Blob and GCP Storage are described as roadmap items.",
      "technologies": [
        "Python"
      ],
      "maturity": "not_assessed",
      "license": "MIT",
      "source_basis": [
        "repository_description",
        "repository_readme",
        "github_metadata"
      ],
      "last_verified": "2026-09-07",
      "capabilities": [
        "AWS S3 scanning",
        "misconfiguration detection"
      ],
      "caveat": "Do not infer Azure or GCP support from the roadmap."
    },
    {
      "name": "code-review-agent-mcp",
      "url": "https://github.com/frangelbarrera/code-review-agent-mcp",
      "visibility": "public",
      "primary_category": "application_and_ai_security",
      "secondary_categories": [
        "code_review",
        "owasp",
        "mcp"
      ],
      "project_type": "mcp_server",
      "summary": "MCP server for AI-assisted code review, including bug detection and OWASP Top 10 security checks, with configurable harshness.",
      "technologies": [
        "Python"
      ],
      "maturity": "not_assessed",
      "license": "MIT",
      "source_basis": [
        "repository_description",
        "repository_readme",
        "github_metadata"
      ],
      "last_verified": "2026-09-07",
      "capabilities": [
        "Code review",
        "security checks",
        "MCP integration"
      ],
      "caveat": "Review findings require human validation; no claim of complete vulnerability detection is made."
    },
    {
      "name": "DidILeak",
      "url": "https://github.com/frangelbarrera/DidILeak",
      "visibility": "public",
      "primary_category": "application_and_ai_security",
      "secondary_categories": [
        "privacy",
        "secret_scanning"
      ],
      "project_type": "security_tool",